{
  "eventClassName": "com.backbase.identity.device.event.spec.v1.DeviceAddedEvent",
  "id": "device-registered",
  "eventBusinessName": "Device Registered",
  "recipientType": "internal",
  "extractor": "#this['internalUserId']",
  "generalNotifications": [
    {
      "id": "device-registered",
      "name": "Device Registered",
      "userPreferenceEnabled": false,
      "manageable": false,
      "additionalFilterLogic": "#lineOfBusiness != null ? #lineOfBusiness == 'RETAIL' : true",
      "deliveryOptions": [
        {
          "channel": "email",
          "channelSettings": "/device-registered-retail/email/email_channel-settings.json",
          "isEnabledByDefault": true,
          "isManageableByUser": false,
          "engagementTemplates": [
            {
              "path": "/device-registered-retail/email/en_US/engagement-template.json",
              "locale": "en_US"
            }
          ]
        }
      ]
    },
    {
      "id": "device-registered-business",
      "name": "Device Registered",
      "userPreferenceEnabled": false,
      "manageable": false,
      "additionalFilterLogic": "#lineOfBusiness != null ? #lineOfBusiness == 'BUSINESS' : false",
      "deliveryOptions": [
        {
          "channel": "email",
          "channelSettings": "/device-registered-business/email/email_channel-settings.json",
          "isEnabledByDefault": true,
          "isManageableByUser": false,
          "engagementTemplates": [
            {
              "path": "/device-registered-business/email/en_US/engagement-template.json",
              "locale": "en_US"
            }
          ]
        }
      ]
    }
  ]
}