{
  "eventClassName": "com.backbase.dbs.user.manager.event.spec.v2.UpdatePhoneNumberSecNotEvent",
  "id": "phone-number-updated",
  "eventBusinessName": "Phone Number Updated",
  "recipientType": "internal",
  "extractor": "#this['userInternalId']",
  "generalNotifications": [
    {
      "id": "phone-number-updated",
      "name": "Phone number updated",
      "userPreferenceEnabled": false,
      "manageable": false,
      "deliveryOptions": [
        {
          "channel": "email",
          "channelSettings": "/phone-number-updated/email/email_channel-settings.json",
          "isEnabledByDefault": true,
          "isManageableByUser": false,
          "engagementTemplates": [
            {
              "content": {
                "subject": "Phone number updated to online banking",
                "body": "file:/phone-number-updated/email/assets/phone-number-updated-template.html"
              },
              "locale": "en_US"
            }
          ]
        }
      ]
    }
  ]
}