{
  "eventClassName": "com.backbase.identity.accountrecovery.event.spec.v1.PasswordResetSuccessEvent",
  "id": "password-reset-success",
  "eventBusinessName": "Password Reset Success",
  "recipientType": "internal",
  "extractor": "#this['userInternalId']",
  "generalNotifications": [
    {
      "id": "password-reset-success",
      "name": "Password Reset Success",
      "userPreferenceEnabled": false,
      "manageable": false,
      "deliveryOptions": [
        {
          "channel": "email",
          "channelSettings": "/password-reset-success/email/email_channel-settings.json",
          "isEnabledByDefault": true,
          "isManageableByUser": false,
          "engagementTemplates": [
            {
              "content": {
                "subject": "You changed your password",
                "body": "file:/password-reset-success/email/assets/password-reset-success-template.html"
              },
              "locale": "en_US"
            }
          ]
        }
      ]
    }
  ]
}