{
  "eventClassName": "com.backbase.dbs.user.manager.event.spec.v2.ChangeUsernameSecNotEvent",
  "id": "username-changed",
  "eventBusinessName": "Username Changed",
  "recipientType": "internal",
  "extractor": "#this['userInternalId']",
  "generalNotifications": [
    {
      "id": "username-changed",
      "name": "Username Changed",
      "userPreferenceEnabled": false,
      "deliveryOptions": [
        {
          "channel": "email",
          "channelSettings": "/username-changed/email/email_channel-settings.json",
          "isEnabledByDefault": true,
          "isManageableByUser": false,
          "engagementTemplates": [
            {
              "content": {
                "subject": "You changed your username",
                "body": "file:/username-changed/email/assets/username-changed-template.html"
              },
              "locale": "en_US"
            }
          ]
        }
      ]
    }
  ]
}